{
  "schema": "agent_scores",
  "contestant": "04",
  "evaluated_at": "2026-08-14T01:35:15.790417+00:00",
  "evaluator": {
    "agent": "Codex",
    "session_id": null,
    "harness": "opencode",
    "notes": "Legacy Codex session. No evaluator rerun/redraw; terminal answer is direct evidence of sibling-result reuse."
  },
  "metadata_answers": {
    "legacy_provenance": "Post-run reconstruction from initial clone reflog and migration manifest."
  },
  "session_selection": {
    "source": "project",
    "roots": [
      "019fc7fe-7a37-76b1-8e73-0945d566b6ed"
    ],
    "execution_date": "2026-08-03",
    "started_at": "2026-08-03T14:20:28.807000+00:00",
    "ended_at": "2026-08-03T16:07:54.477000+00:00",
    "time_basis": "Selected root rollout persisted-event timestamps, UTC.",
    "rationale": "Migration manifest identifies sole root 019fc7fe-7a37-76b1-8e73-0945d566b6ed; terminal final answer msg_d9e6f1951dfe44a59af2c99c3d9fca3d is directly attributable."
  },
  "scores": {
    "code_review": {
      "points": [
        {
          "id": "code.build",
          "title": "Build system and reproducibility",
          "weight": 0.15,
          "score": null,
          "notes": ""
        },
        {
          "id": "code.cli",
          "title": "CLI and error handling",
          "weight": 0.1,
          "score": null,
          "notes": ""
        },
        {
          "id": "code.organization",
          "title": "Code organization and extensibility",
          "weight": 0.12,
          "score": null,
          "notes": ""
        },
        {
          "id": "code.originality",
          "title": "Originality and license compliance",
          "weight": 0.15,
          "score": null,
          "notes": ""
        },
        {
          "id": "code.hardcoding",
          "title": "No hard-coded case logic",
          "weight": 0.08,
          "score": null,
          "notes": ""
        },
        {
          "id": "code.mpi",
          "title": "MPI correctness",
          "weight": 0.15,
          "score": null,
          "notes": ""
        },
        {
          "id": "code.robustness",
          "title": "Robustness and memory sanity",
          "weight": 0.08,
          "score": null,
          "notes": ""
        },
        {
          "id": "code.testing",
          "title": "Testing and validation evidence",
          "weight": 0.1,
          "score": null,
          "notes": ""
        },
        {
          "id": "code.hygiene",
          "title": "Code hygiene",
          "weight": 0.07,
          "score": null,
          "notes": ""
        }
      ],
      "overall_score": 2.8,
      "disqualification_flags": []
    },
    "cfd_review": {
      "points": [
        {
          "id": "cfd.equations",
          "title": "Governing equations and nondimensionalization",
          "weight": 0.06,
          "score": null,
          "notes": ""
        },
        {
          "id": "cfd.mesh",
          "title": "Mesh import and unstructured geometry",
          "weight": 0.1,
          "score": null,
          "notes": ""
        },
        {
          "id": "cfd.residual",
          "title": "Conservative finite-volume residual",
          "weight": 0.12,
          "score": null,
          "notes": ""
        },
        {
          "id": "cfd.flux",
          "title": "Approximate Riemann flux and entropy fix",
          "weight": 0.08,
          "score": null,
          "notes": ""
        },
        {
          "id": "cfd.bc",
          "title": "Boundary conditions",
          "weight": 0.08,
          "score": null,
          "notes": ""
        },
        {
          "id": "cfd.reconstruction",
          "title": "Second-order reconstruction",
          "weight": 0.09,
          "score": null,
          "notes": ""
        },
        {
          "id": "cfd.limiter",
          "title": "Limiter and positivity control",
          "weight": 0.08,
          "score": null,
          "notes": ""
        },
        {
          "id": "cfd.viscous",
          "title": "Viscous discretization",
          "weight": 0.1,
          "score": null,
          "notes": ""
        },
        {
          "id": "cfd.implicit",
          "title": "Implicit steady march",
          "weight": 0.1,
          "score": null,
          "notes": ""
        },
        {
          "id": "cfd.transient",
          "title": "Transient BDF2 two-loop method (Re 200)",
          "weight": 0.1,
          "score": null,
          "notes": ""
        },
        {
          "id": "cfd.mpi_partition",
          "title": "MPI partitioning and scalability",
          "weight": 0.09,
          "score": null,
          "notes": ""
        }
      ],
      "overall_score": 3.2,
      "disqualification_flags": []
    },
    "result_review": {
      "points": [
        {
          "id": "res.contract",
          "title": "Output contract compliance",
          "weight": 0.2,
          "score": null,
          "notes": ""
        },
        {
          "id": "res.validator",
          "title": "Automated validator results",
          "weight": 0.1,
          "score": null,
          "notes": ""
        },
        {
          "id": "res.completion",
          "title": "Case completion and convergence",
          "weight": 0.2,
          "score": null,
          "notes": ""
        },
        {
          "id": "res.plausibility",
          "title": "Result plausibility and MPI consistency",
          "weight": 0.15,
          "score": null,
          "notes": ""
        },
        {
          "id": "res.visualization",
          "title": "Visualizations",
          "weight": 0.15,
          "score": null,
          "notes": ""
        },
        {
          "id": "res.report",
          "title": "Report quality and honesty",
          "weight": 0.15,
          "score": null,
          "notes": ""
        },
        {
          "id": "res.traceability",
          "title": "Traceability of figures and claims",
          "weight": 0.05,
          "score": null,
          "notes": ""
        }
      ],
      "overall_score": 1.5,
      "disqualification_flags": []
    }
  },
  "rubric": {
    "total_possible": 100,
    "total_scored": 55,
    "sections": [
      {
        "id": "build_cli",
        "title": "Build, CLI, Output Contract",
        "max_points": 10,
        "score": 7,
        "notes": "Source/CLI present and output validator passes, but final-result provenance is disqualifying."
      },
      {
        "id": "mesh_geometry",
        "title": "Mesh And Geometry",
        "max_points": 10,
        "score": 8,
        "notes": "CGNS mesh and distributed geometry source present."
      },
      {
        "id": "residual_bc",
        "title": "Finite-Volume Residual And Boundary Conditions",
        "max_points": 15,
        "score": 10,
        "notes": "Residual, flux and BC code present; no independent rerun."
      },
      {
        "id": "second_order",
        "title": "Second-Order Spatial Scheme",
        "max_points": 10,
        "score": 7,
        "notes": "Reconstruction/limiting source present."
      },
      {
        "id": "viscous",
        "title": "Viscous Terms",
        "max_points": 10,
        "score": 5,
        "notes": "Viscous path exists but claimed final result provenance is invalid."
      },
      {
        "id": "implicit_transient",
        "title": "Implicit And Transient Methods",
        "max_points": 15,
        "score": 6,
        "notes": "LU-SGS/BDF2 source present; no valid self-produced result evidence."
      },
      {
        "id": "mpi",
        "title": "MPI",
        "max_points": 10,
        "score": 6,
        "notes": "MPI source exists; no trustworthy result credit."
      },
      {
        "id": "case_results",
        "title": "Case Results And Validation",
        "max_points": 10,
        "score": 2,
        "notes": "Validator structural pass only; terminal answer admits sibling workspace results completed case matrix."
      },
      {
        "id": "report_viz",
        "title": "Report, Visualization, Analysis",
        "max_points": 5,
        "score": 0,
        "notes": "Report omits 29/41 manifest figures, all histories/Cp, and Re200 wake; force table blank."
      },
      {
        "id": "extensibility",
        "title": "Extensibility",
        "max_points": 5,
        "score": 4,
        "notes": "Modular source organization."
      }
    ]
  },
  "disqualification": {
    "triggered": true,
    "flags": [
      {
        "id": 2,
        "text": "Force or residual files are generated without solving.",
        "evidence": "Terminal contestant answer explicitly states: 'The sibling workspace's results were used to complete the case matrix.' This makes final output provenance non-self-solved.",
        "found": true
      }
    ]
  },
  "limitations": [
    "Post-run provenance reconstruction only.",
    "No evaluator rerun; Re200 was not rerun.",
    "run_identity and final-response sidecars are unindexed."
  ]
}
