{
  "schema": "agent_scores",
  "contestant": "12",
  "evaluated_at": "2026-08-27T16:20:00+00:00",
  "evaluator": {
    "agent": "codex",
    "session_id": null,
    "harness": "codex",
    "notes": "Curated source and delivered packages reviewed; no reruns."
  },
  "metadata_answers": {},
  "session_selection": {
    "source": "project",
    "roots": [
      "01a0185d-3ad7-70f3-8f0d-714e662ee9e7"
    ],
    "execution_date": "2026-08-19",
    "started_at": "2026-08-19T04:53:10.634000+00:00",
    "ended_at": "2026-08-19T22:07:02.795000+00:00",
    "time_basis": "selected bundled root UTC timestamps",
    "rationale": "Production root plus nine persisted descendants in workspace-local telemetry."
  },
  "scores": {
    "code_review": {
      "points": [
        {
          "id": "code.build",
          "title": "Build system and reproducibility",
          "weight": 0.15,
          "score": 5,
          "notes": "CMake/MPI source submitted."
        },
        {
          "id": "code.cli",
          "title": "CLI and error handling",
          "weight": 0.1,
          "score": 4,
          "notes": "Documented runner."
        },
        {
          "id": "code.organization",
          "title": "Code organization and extensibility",
          "weight": 0.12,
          "score": 5,
          "notes": "Header/source separation."
        },
        {
          "id": "code.originality",
          "title": "Originality and license compliance",
          "weight": 0.15,
          "score": 4,
          "notes": "No authorship investigation."
        },
        {
          "id": "code.hardcoding",
          "title": "No hard-coded case logic",
          "weight": 0.08,
          "score": 4,
          "notes": "Configuration-driven cases."
        },
        {
          "id": "code.mpi",
          "title": "MPI correctness",
          "weight": 0.15,
          "score": 4,
          "notes": "Partition/halo implementation and smoke evidence."
        },
        {
          "id": "code.robustness",
          "title": "Robustness and memory sanity",
          "weight": 0.08,
          "score": 4,
          "notes": "Guards and line search."
        },
        {
          "id": "code.testing",
          "title": "Testing and validation evidence",
          "weight": 0.1,
          "score": 5,
          "notes": "All eight explicit packages validate."
        },
        {
          "id": "code.hygiene",
          "title": "Code hygiene",
          "weight": 0.07,
          "score": 4,
          "notes": "Curated submission clean."
        }
      ],
      "overall_score": 4.37,
      "disqualification_flags": []
    },
    "cfd_review": {
      "points": [
        {
          "id": "cfd.equations",
          "title": "Governing equations and nondimensionalization",
          "weight": 0.06,
          "score": 5,
          "notes": "Conservative formulation documented."
        },
        {
          "id": "cfd.mesh",
          "title": "Mesh import and unstructured geometry",
          "weight": 0.1,
          "score": 5,
          "notes": "Unstructured CGNS path."
        },
        {
          "id": "cfd.residual",
          "title": "Conservative finite-volume residual",
          "weight": 0.12,
          "score": 5,
          "notes": "Face residual source."
        },
        {
          "id": "cfd.flux",
          "title": "Approximate Riemann flux and entropy fix",
          "weight": 0.08,
          "score": 4,
          "notes": "Rusanov robustness, diffusion limitation."
        },
        {
          "id": "cfd.bc",
          "title": "Boundary conditions",
          "weight": 0.08,
          "score": 5,
          "notes": "Boundary methods documented."
        },
        {
          "id": "cfd.reconstruction",
          "title": "Second-order reconstruction",
          "weight": 0.09,
          "score": 4,
          "notes": "Second-order reconstruction."
        },
        {
          "id": "cfd.limiter",
          "title": "Limiter and positivity control",
          "weight": 0.08,
          "score": 4,
          "notes": "Positivity treatment."
        },
        {
          "id": "cfd.viscous",
          "title": "Viscous discretization",
          "weight": 0.1,
          "score": 5,
          "notes": "Laminar terms."
        },
        {
          "id": "cfd.implicit",
          "title": "Implicit steady march",
          "weight": 0.1,
          "score": 4,
          "notes": "Frozen block preconditioner."
        },
        {
          "id": "cfd.transient",
          "title": "Transient BDF2 two-loop method (Re 200)",
          "weight": 0.1,
          "score": 4,
          "notes": "Delivered Re200 periodic package."
        },
        {
          "id": "cfd.mpi_partition",
          "title": "MPI partitioning and scalability",
          "weight": 0.09,
          "score": 4,
          "notes": "METIS/halo evidence."
        }
      ],
      "overall_score": 4.46,
      "disqualification_flags": []
    },
    "result_review": {
      "points": [
        {
          "id": "res.contract",
          "title": "Output contract compliance",
          "weight": 0.2,
          "score": 5,
          "notes": "Eight packages structurally complete."
        },
        {
          "id": "res.validator",
          "title": "Automated validator results",
          "weight": 0.1,
          "score": 5,
          "notes": "Explicit validator passed."
        },
        {
          "id": "res.completion",
          "title": "Case completion and convergence",
          "weight": 0.2,
          "score": 4,
          "notes": "Canonical statuses and horizons delivered."
        },
        {
          "id": "res.plausibility",
          "title": "Result plausibility and MPI consistency",
          "weight": 0.15,
          "score": 4,
          "notes": "Results broadly plausible; no evaluator rerun."
        },
        {
          "id": "res.visualization",
          "title": "Visualizations",
          "weight": 0.15,
          "score": 5,
          "notes": "Referenced figures supplied."
        },
        {
          "id": "res.report",
          "title": "Report quality and honesty",
          "weight": 0.15,
          "score": 5,
          "notes": "Complete report with limitations."
        },
        {
          "id": "res.traceability",
          "title": "Traceability of figures and claims",
          "weight": 0.05,
          "score": 4,
          "notes": "Generated TeX retained to make figures/report build."
        }
      ],
      "overall_score": 4.6,
      "disqualification_flags": []
    }
  },
  "rubric": {
    "total_possible": 100,
    "total_scored": 90,
    "sections": [
      {
        "id": "build_cli",
        "title": "Build, CLI, Output Contract",
        "max_points": 10,
        "score": 9,
        "notes": "Strong source and contract."
      },
      {
        "id": "mesh_geometry",
        "title": "Mesh And Geometry",
        "max_points": 10,
        "score": 10,
        "notes": "CGNS unstructured support."
      },
      {
        "id": "residual_bc",
        "title": "Finite-Volume Residual And Boundary Conditions",
        "max_points": 15,
        "score": 14,
        "notes": "Complete source; no clean rerun."
      },
      {
        "id": "second_order",
        "title": "Second-Order Spatial Scheme",
        "max_points": 10,
        "score": 9,
        "notes": "Documented reconstruction/limiting."
      },
      {
        "id": "viscous",
        "title": "Viscous Terms",
        "max_points": 10,
        "score": 10,
        "notes": "Laminar implementation."
      },
      {
        "id": "implicit_transient",
        "title": "Implicit And Transient Methods",
        "max_points": 15,
        "score": 13,
        "notes": "Frozen preconditioner limitations."
      },
      {
        "id": "mpi",
        "title": "MPI",
        "max_points": 10,
        "score": 8,
        "notes": "Distributed design and smoke comparison."
      },
      {
        "id": "case_results",
        "title": "Case Results And Validation",
        "max_points": 10,
        "score": 8,
        "notes": "Structural pass, no evaluator rerun."
      },
      {
        "id": "report_viz",
        "title": "Report, Visualization, Analysis",
        "max_points": 5,
        "score": 5,
        "notes": "Complete referenced report."
      },
      {
        "id": "extensibility",
        "title": "Extensibility",
        "max_points": 5,
        "score": 4,
        "notes": "Clear interfaces; 2-D scope."
      }
    ]
  },
  "case_scores": {
    "naca0012_m015_inviscid": {
      "score": 4,
      "notes": "Delivered structural package."
    },
    "naca0012_m080_inviscid": {
      "score": 4,
      "notes": "Delivered structural package."
    },
    "naca0012_m200_inviscid": {
      "score": 4,
      "notes": "Delivered structural package."
    },
    "naca0012_m015_laminar_re5000": {
      "score": 4,
      "notes": "Delivered structural package."
    },
    "naca0012_m080_laminar_re5000": {
      "score": 4,
      "notes": "Delivered structural package."
    },
    "naca0012_m200_laminar_re5000": {
      "score": 4,
      "notes": "Delivered structural package."
    },
    "cylinder_m010_laminar_re20": {
      "score": 4,
      "notes": "Delivered structural package."
    },
    "cylinder_m010_laminar_re200": {
      "score": 4.5,
      "notes": "Delivered full-horizon periodic evidence; not rerun."
    }
  },
  "disqualification": {
    "triggered": false,
    "flags": []
  },
  "limitations": [
    "No evaluator build or MPI rerun.",
    "Re200 was not rerun.",
    "Structural validation does not independently prove numerical accuracy."
  ]
}
